pub_date	title	venue	excerpt	citation	url_slug	paper_url
2021-03-01	COVID-MTL: Multitask Learning with Shift3D and Random-weighted Loss for Automated Diagnosis and Severity Assessment of COVID-19	Patterm Recognition	This paper is about COVID-10 diagnosis with deep learning. The number 2 is left for future work.	Guoqing Bao, Huai Chen, Tongliang Liu, Guanzhong Gong, Yong Yin, Lisheng Wang, Xiuying Wang (2021). "COVID-MTL: Multitask Learning with Shift3D and Random-weighted Loss for Automated Diagnosis and Severity Assessment of COVID-19" <i>Pattern Recognition</i>. 1(1).	COVIDMTL	https://arxiv.org/abs/2012.05509
2021-02-09	PathoFusion: Recognition of pathomorphological features and mapping of immunohistochemical data with an open-source AI framework	Cancers	We proposed an AI framework for cross-modality analysis of whole-slide pathology images. The number 3 is left for future work.	Guoqing Bao, Xiuying Wang, Ran Xu, Christina Loh, Oreoluwa Daniel Adeyinka, Dula Asheka Pieris, Svetlana Cherepanoff, Gary Gracie, Maggie Lee, Kerrie L. McDonald, Anna K. Nowak, Richard Banati, Michael E. Buckland, and Manuel B. Graeber, (2021). "PathoFusion: Recognition of pathomorphological features and mapping of immunohistochemical data with an open-source AI framework" <i>Cancers</i>. 13(4):617.	PathoFusion	https://doi.org/10.3390/cancers13040617
2020-10-01	Identification of lncRNA Signature Associated With Pan-cancer Prognosis	IEEE Journal of Biomedical and Health Informatics	We proposed a machine learning based framework for pan-cancer genomic analysis. Published	Guoqing Bao, Ran Xu, Xiuying Wang, Jianxiong Ji, Linlin Wang, Wenjie Li, Qing Zhang, Bin Huang, Anjing Chen, Beihua Kong, Qifeng Yang, Xinyu Wang, Jian Wang, Xingang Li. (2020). "Paper Title Number 3." <i>IEEE Journal of Biomedical and Health Informatics</i>. doi: 10.1109/JBHI.2020.3027680.	Pancancer	https://doi.org/10.1109/JBHI.2020.3027680
2020-11-1	Depthwise Multiception Convolution for Reducing Network Parameters without Sacrificing Accuracy	The 16th International Conference on Control, Automation, Robotics and Vision	We proposed a new convolutional method to improve the performance of depthwise separable convolution	Guoqing Bao, Manuel B. Graeber, Xiuying Wang (2020). "Depthwise Multiception Convolution for Reducing Network Parameters without Sacrificing Accuracy" <i>ICARCV</i> pp. 747-752, doi: 10.1109/ICARCV50220.2020.9305369	Multiception	https://doi.org/10.1109/ICARCV50220.2020.9305369
2020-11-2	A Bifocal Classification and Fusion Network for Multimodal Image Analysis in Histopathology	The 16th International Conference on Control, Automation, Robotics and Vision	We proposed a bifocal classification and fusion network for analysis of pathology images	Guoqing Bao, Manuel B. Graeber, Xiuying Wang (2020). "A Bifocal Classification and Fusion Network for Multimodal Image Analysis in Histopathology" <i>ICARCV</i> pp. 747-752, doi: 10.1109/ICARCV50220.2020.9305360	Bifocal	https://doi.org/10.1109/ICARCV50220.2020.9305360

